{
  "$schema": "https://json-schema.org/draft/2020-12/schema",
  "$id": "https://1321.dev/bench/schemas/adjudication.schema.json",
  "title": "Blinded gold adjudication receipt",
  "description": "One human reviewer's decision over one gold candidate file, content-bound to the exact candidate bytes — the same proposal/decision separation the memory ledger enforces, applied to test data. Two accept receipts from verifiably distinct reviewers are required before freeze-pack.mjs will freeze a clip. v1 enforces distinct declared identities (name AND git identity) and reviewer != drafter; anchoring each receipt in the reviewer's own git commit ancestry is the documented expectation but is not yet mechanically verified — see bench/README.md.",
  "type": "object",
  "additionalProperties": false,
  "required": [
    "schema",
    "review_id",
    "pack_id",
    "clip_id",
    "candidate",
    "reviewer",
    "drafter",
    "blinded",
    "action",
    "reason",
    "unit_decisions",
    "minutes_spent",
    "created_at"
  ],
  "properties": {
    "$schema": { "type": "string" },
    "schema": { "const": "studio.bench.review.v1" },
    "review_id": {
      "type": "string",
      "pattern": "^bench-review:sha256:[a-f0-9]{64}$",
      "description": "Content id of this receipt's canonical body (everything except review_id). A receipt whose id does not match its bytes is invalid."
    },
    "pack_id": { "type": "string", "minLength": 1 },
    "clip_id": { "type": "string", "minLength": 1 },
    "candidate": {
      "type": "object",
      "additionalProperties": false,
      "required": ["path", "content_id", "bytes"],
      "description": "File receipt of the exact gold candidate bytes reviewed. A decision that does not bind current bytes cannot be used to freeze — same rule as the memory ledger.",
      "properties": {
        "path": { "type": "string", "minLength": 1 },
        "content_id": { "type": "string", "pattern": "^sha256:[a-f0-9]{64}$" },
        "bytes": { "type": "integer", "minimum": 1 }
      }
    },
    "reviewer": {
      "type": "object",
      "additionalProperties": false,
      "required": ["name", "git_identity"],
      "description": "Named human identity. Must differ from the drafter and from the other freezing reviewer on BOTH fields. String inequality alone cannot prove two humans exist; recruiting a real second Korean-fluent reviewer is the binding constraint on this whole pipeline and is not solvable in code.",
      "properties": {
        "name": { "type": "string", "minLength": 1 },
        "git_identity": { "type": "string", "minLength": 1 }
      }
    },
    "drafter": {
      "type": "string",
      "minLength": 1,
      "description": "Copied from the candidate so the receipt is self-describing; must match the candidate bytes."
    },
    "blinded": {
      "type": "boolean",
      "description": "True only if the reviewer saw source media plus candidate gold without seeing any system's output for these windows. Freeze requires true."
    },
    "action": { "enum": ["accept", "reject", "amend"] },
    "reason": { "type": "string", "minLength": 1 },
    "unit_decisions": {
      "type": "array",
      "minItems": 1,
      "items": {
        "type": "object",
        "additionalProperties": false,
        "required": ["t_start", "t_end", "action"],
        "properties": {
          "t_start": { "type": "number", "minimum": 0 },
          "t_end": { "type": "number", "exclusiveMinimum": 0 },
          "action": { "enum": ["accept", "reject", "amend"] },
          "note": { "type": ["string", "null"] }
        }
      }
    },
    "minutes_spent": {
      "type": ["number", "null"],
      "minimum": 0,
      "description": "Honest per-unit cost accounting. The claim that agent drafting cuts adjudication cost must be measured, not asserted."
    },
    "created_at": { "type": "string", "format": "date-time" }
  }
}
