{
  "review_id": "bench-review:sha256:a66e3c7c1307583a5fdcbe9d130d15093b47bd53cf791cf30a1e097d29889b82",
  "schema": "studio.bench.review.v1",
  "pack_id": "hard-ko-provider-authorized-v1",
  "clip_id": "Ux-TMWnmntM",
  "candidate": {
    "path": "bench/packs/hard-ko-provider-authorized-v1/Ux-TMWnmntM.gold.json",
    "content_id": "sha256:ff17cd6db4ddd9d4ffbb4b27108223c0f37559f2e8ee79e0ef0ee247e642036f",
    "bytes": 10768
  },
  "reviewer": {
    "name": "Bench Reviewer A",
    "git_identity": "Bench Reviewer A <bench-reviewer-a@1321.local>"
  },
  "drafter": "agent:gold-drafter-v1",
  "blinded": true,
  "action": "accept",
  "reason": "Hackathon blinded panel accept after audio listen of every exact window; Korean transcription, English guidance, and critical units accepted as written for this candidate.",
  "unit_decisions": [
    {
      "t_start": 0,
      "t_end": 1.55,
      "action": "accept",
      "note": null
    },
    {
      "t_start": 1.55,
      "t_end": 1.95,
      "action": "accept",
      "note": null
    },
    {
      "t_start": 1.95,
      "t_end": 7.7,
      "action": "accept",
      "note": null
    },
    {
      "t_start": 11.9,
      "t_end": 12.35,
      "action": "accept",
      "note": null
    },
    {
      "t_start": 12.7,
      "t_end": 13.6,
      "action": "accept",
      "note": null
    },
    {
      "t_start": 14,
      "t_end": 18.8,
      "action": "accept",
      "note": null
    },
    {
      "t_start": 18.8,
      "t_end": 19,
      "action": "accept",
      "note": null
    },
    {
      "t_start": 19,
      "t_end": 19.15,
      "action": "accept",
      "note": null
    },
    {
      "t_start": 19.15,
      "t_end": 20.2,
      "action": "accept",
      "note": null
    },
    {
      "t_start": 20.2,
      "t_end": 25.2,
      "action": "accept",
      "note": null
    },
    {
      "t_start": 25.52,
      "t_end": 28.12,
      "action": "accept",
      "note": null
    },
    {
      "t_start": 28.12,
      "t_end": 28.32,
      "action": "accept",
      "note": null
    },
    {
      "t_start": 28.32,
      "t_end": 39.87,
      "action": "accept",
      "note": null
    }
  ],
  "minutes_spent": null,
  "created_at": "2026-07-19T20:18:35.000Z"
}
