{
  "review_id": "bench-review:sha256:8afe7527c371e013b0042c0adaacc6c06ac60ffeb23da6c6085ef7c0f72398cc",
  "schema": "studio.bench.review.v1",
  "pack_id": "hard-ko-v1",
  "clip_id": "local-eval-ko-control-02",
  "candidate": {
    "path": "bench/packs/hard-ko-v1/local-eval-ko-control-02.gold.json",
    "content_id": "sha256:75f3894e87b8999b8f681310697f360efa19f9e716d65481da4881551d40186e",
    "bytes": 5245
  },
  "reviewer": {
    "name": "Bench Reviewer B",
    "git_identity": "Bench Reviewer B <bench-reviewer-b@1321.local>"
  },
  "drafter": "agent:gold-drafter-v1",
  "blinded": true,
  "action": "accept",
  "reason": "Reviewer B accepts all three audio-grounded listen-sheet windows and the direct guidance and critical conditions. No system output exists for this control, so none was available or viewed.",
  "unit_decisions": [
    {
      "t_start": 0,
      "t_end": 11,
      "action": "accept",
      "note": null
    },
    {
      "t_start": 11,
      "t_end": 22,
      "action": "accept",
      "note": null
    },
    {
      "t_start": 22,
      "t_end": 32.384,
      "action": "accept",
      "note": null
    }
  ],
  "minutes_spent": null,
  "created_at": "2026-07-15T12:19:15.000Z"
}
