{
  "review_id": "bench-review:sha256:96e9aae62e99d5912081e84e7a815380300d10f2aafb56f7d6dfd6bd5a0821c7",
  "schema": "studio.bench.review.v1",
  "pack_id": "hard-ko-provider-authorized-v1",
  "clip_id": "Ni5rBtowdnI",
  "candidate": {
    "path": "bench/packs/hard-ko-provider-authorized-v1/Ni5rBtowdnI.gold.json",
    "content_id": "sha256:bb892107fb870f85ca91f42ed4dab1c5fa07ff5a3c9b5d30ebe2ec2adda69986",
    "bytes": 5599
  },
  "reviewer": {
    "name": "Bench Reviewer B",
    "git_identity": "Bench Reviewer B <bench-reviewer-b@1321.local>"
  },
  "drafter": "agent:gold-drafter-v1",
  "blinded": true,
  "action": "accept",
  "reason": "Independent hackathon blinded panel accept after audio listen of every exact window; Korean transcription, English guidance, and critical units accepted as written for this candidate.",
  "unit_decisions": [
    {
      "t_start": 0,
      "t_end": 9.3,
      "action": "accept",
      "note": null
    },
    {
      "t_start": 9.3,
      "t_end": 23,
      "action": "accept",
      "note": null
    },
    {
      "t_start": 23,
      "t_end": 31,
      "action": "accept",
      "note": null
    },
    {
      "t_start": 31,
      "t_end": 45,
      "action": "accept",
      "note": null
    }
  ],
  "minutes_spent": null,
  "created_at": "2026-07-19T20:18:35.000Z"
}
