{
  "review_id": "bench-review:sha256:06e2f528756487059aca08b70d6fad9b9e917dee8fa1cb88cfc108a9100e6866",
  "schema": "studio.bench.review.v1",
  "pack_id": "hard-ko-v1",
  "clip_id": "local-eval-ko-control-01",
  "candidate": {
    "path": "bench/packs/hard-ko-v1/local-eval-ko-control-01.gold.json",
    "content_id": "sha256:0f9d513946ef219e917f1407547b0b81162c3d1ca0f284513434fd6862afca96",
    "bytes": 5046
  },
  "reviewer": {
    "name": "Bench Reviewer A",
    "git_identity": "Bench Reviewer A <bench-reviewer-a@1321.local>"
  },
  "drafter": "agent:gold-drafter-v1",
  "blinded": true,
  "action": "accept",
  "reason": "Reviewer A accepts all three audio-grounded listen-sheet windows and the direct guidance and critical conditions. No system output exists for this control, so none was available or viewed.",
  "unit_decisions": [
    {
      "t_start": 0,
      "t_end": 10,
      "action": "accept",
      "note": null
    },
    {
      "t_start": 10,
      "t_end": 20,
      "action": "accept",
      "note": null
    },
    {
      "t_start": 20,
      "t_end": 28.629,
      "action": "accept",
      "note": null
    }
  ],
  "minutes_spent": null,
  "created_at": "2026-07-15T12:19:12.000Z"
}
